[
    {
        "Title": "7 Things Boomers Grew in Their Backyard That Gen Z Now Pays a Premium For at Farmer's Markets",
        "Summary": "The quiet revolution of the backyard garden, where everyday produce once freely shared now commands a price, reflecting a shift in our connection to food and its origins.",
        "Tags": [
            "'Gardening'",
            "'Farmers'",
            "'Gen Z'",
            "'Sustainability'",
            "'Nostalgia'"
        ],
        "url": "https://raw.githubusercontent.com/ljlabs/vynder-blog/refs/heads/main/livePosts/7 Things Boomers Grew in Their Backyard That Gen Z Now Pays a Premium For at Farmer's Markets.md",
        "image": "https://images.unsplash.com/photo-1658867851985-4b7f06612ba7?crop=entropy&cs=srgb&fm=jpg&ixid=M3w4MjU2NDV8MHwxfHNlYXJjaHw4fHxBJTIwc21hbGwlMkMlMjB3ZWxsLW1haW50YWluZWQlMjBiYWNreWFyZCUyMGdhcmRlbiUyMHdpdGglMjBmbG93ZXJzJTIwYW5kJTIwYSUyMHBhdGlvfGVufDB8fHx8MTc2MjUwNzM0OXww&ixlib=rb-4.1.0&q=85",
        "published": "2025-11-08T07:17:17.493167+00:00",
        "edited": "2025-11-08T07:17:17.493167+00:00",
        "content": "---\nTitle: 7 Things Boomers Grew in Their Backyard That Gen Z Now Pays a Premium For at Farmer's Markets\nSummary: The quiet revolution of the backyard garden, where everyday produce once freely shared now commands a price, reflecting a shift in our connection to food and its origins.\nTags: ['Gardening', 'Farmers', 'Gen Z', 'Sustainability', 'Nostalgia']\nImage: https://images.unsplash.com/photo-1658867851985-4b7f06612ba7?crop=entropy&cs=srgb&fm=jpg&ixid=M3w4MjU2NDV8MHwxfHNlYXJjaHw4fHxBJTIwc21hbGwlMkMlMjB3ZWxsLW1haW50YWluZWQlMjBiYWNreWFyZCUyMGdhcmRlbiUyMHdpdGglMjBmbG93ZXJzJTIwYW5kJTIwYSUyMHBhdGlvfGVufDB8fHx8MTc2MjUwNzM0OXww&ixlib=rb-4.1.0&q=85\nPublishedAt: 2025-11-08T07:17:17.493167+00:00\nEditedAt: 2025-11-08T07:17:17.493167+00:00\n---\nThere's a quiet irony in the way we've come to value food. What was once a staple, grown with calloused hands and shared freely across fences, now often appears under a spotlight, carefully arranged, and priced for its perceived rarity. For many Boomers, a backyard garden wasn't just a hobby; it was a practical extension of the kitchen, a way to stretch a dollar and ensure fresh, wholesome food for the family. They knew the taste of a tomato still waarm from the sun, the scent of basil crushed between fingers, and the simple satisfaction of abundance.\n\nToday, a new generation, often disconnected from the soil, seeks out these very same treasures at bustling farmer's markets. We pay a premium for \"heirloom,\" \"organic,\" and \"locally sourced,\" terms that, for our parents and grandparents, were simply \"garden variety.\" It's a testament to a shifting landscape, where the quiet resilience of growing your own has transformed into a sought-after luxury. We're not judging; we're simply observing the beautiful, cyclical nature of what we cherish.\n\nHere are seven things that once thrived in a Boomer's backyard, now gracing the tables of farmer's markets with a new, elevated status:\n\n### 1. Heirloom Tomatoes\n\n![Assortment of heirloom tomatoes in various colors.](https://images.unsplash.com/photo-1758221055853-479a0de23e66?crop=entropy&cs=srgb&fm=jpg&ixid=M3w4MjU2NDV8MHwxfHNlYXJjaHw1fHxoZWlybG9vbSUyMHRvbWF0b2VzJTIwZ2FyZGVufGVufDB8fHx8MTc2MjUxNDgwNXww&ixlib=rb-4.1.0&q=85)\n\nFor Boomers, a tomato was simply a tomato, but the varieties they grew were often those passed down through generations\u00e2\u20ac\u201dthe lumpy, colorful, intensely flavored fruits that supermarket shelves rarely carried. These weren't \"heirlooms\" in name, but in practice. They were simply *good* tomatoes. Now, we marvel at their irregular shapes and vibrant hues, paying top dollar for a taste of that forgotten richness. We seek out the Brandywine, the Cherokee Purple, the Mortgage Lifter, not just for their flavor, but for the story they tell, a story our elders knew by heart.\n\n### 2. Fresh Herbs\n\n![A garden filled with lots of green plants](https://images.unsplash.com/photo-1722169866524-233f5748be42?crop=entropy&cs=srgb&fm=jpg&ixid=M3w4MjU2NDV8MHwxfHNlYXJjaHwzfHxmcmVzaCUyMGJhc2lsJTIwbWludCUyMHJvc2VtYXJ5JTIwZ2FyZGVufGVufDB8fHx8MTc2MjUxNDgyMXww&ixlib=rb-4.1.0&q=85)\n\nA small patch of basil, a sprawling mint plant, a hardy rosemary bush\u00e2\u20ac\u201dthese were standard issue in many Boomer gardens. They were snipped for dinner, dried for winter, and used without a second thought. The idea of buying a small plastic clamshell of fresh herbs for several dollars would have seemed absurd. Today, we understand the difference fresh makes, and we're willing to invest in those fragrant bundles, recognizing the vibrant punch they add to our cooking, a punch our parents took for granted.\n\n### 3. Organic Berries\n\n![a group of red strawberries](https://images.unsplash.com/photo-1655745570225-d92558d90e7d?crop=entropy&cs=srgb&fm=jpg&ixid=M3w4MjU2NDV8MHwxfHNlYXJjaHwxfHxyaXBlJTIwcmVkJTIwc3RyYXdiZXJyaWVzfGVufDB8fHx8MTc2MjUxODY4MHww&ixlib=rb-4.1.0&q=85)\n\nStrawberries, raspberries, blueberries\u00e2\u20ac\u201dmany Boomer backyards boasted a small berry patch, a source of sweet summer treats and ingredients for homemade jams. These berries were, by default, organic, grown without chemical intervention because that was simply how it was done. The joy was in the picking, the stained fingers, and the immediate gratification. Now, we seek out \"certified organic\" berries, understanding the value of fruit grown without pesticides, and we pay for the peace of mind and the superior flavor that our elders enjoyed as a matter of course.\n\n### 4. Specialty Leafy Greens\n\n![A garden filled with lots of green plants](https://images.unsplash.com/photo-1722169866524-233f5748be42?crop=entropy&cs=srgb&fm=jpg&ixid=M3w4MjU2NDV8MHwxfHNlYXJjaHwzfHxmcmVzaCUyMGJhc2lsJTIwbWludCUyMHJvc2VtYXJ5JTIwZ2FyZGVufGVufDB8fHx8MTc2MjUxNDgyMXww&ixlib=rb-4.1.0&q=85)\n\nWhile iceberg lettuce might have dominated some dinner tables, many Boomer gardens also featured robust kale, colorful Swiss chard, and peppery arugula. These weren't exotic superfoods; they were just hardy, nutritious greens that grew well and provided sustenance. They were chopped into soups, saut\u00c3\u00a9ed with garlic, or added to salads. Today, these same greens are celebrated for their health benefits and unique flavors, often bundled and sold at a premium, a testament to their rediscovered culinary appeal.\n\n### 5. Zucchini Blossoms\n\n![A close up view of a yellow flower](https://images.unsplash.com/photo-1739970846971-95f1e800a622?crop=entropy&cs=srgb&fm=jpg&ixid=M3w4MjU2NDV8MHwxfHNlYXJjaHwxN3x8QSUyMGNsb3NlLXVwJTIwb2YlMjBhJTIwdmlicmFudCUyMHllbGxvdyUyMHp1Y2NoaW5pJTIwYmxvc3NvbSUyMG9uJTIwYSUyMHBsYW50LnxlbnwwfHx8fDE3NjI1MTQ5Njd8MA&ixlib=rb-4.1.0&q=85)\n\nAnyone who has ever grown zucchini knows the sheer abundance of the plant. And with that abundance comes the beautiful, edible blossoms. For many Boomers, these delicate flowers might have been a fleeting curiosity, perhaps fried lightly or simply left to become fruit. Now, these vibrant yellow blooms are a seasonal delicacy, gracing restaurant menus and farmer's market stalls, often stuffed with cheese and herbs, a true gourmet item that was once just a byproduct of a prolific plant.\n\n### 6. Specialty Garlic\n\n![a group of garlic plants growing in a garden](https://images.unsplash.com/photo-1687365301009-af603af2a8a9?crop=entropy&cs=srgb&fm=jpg&ixid=M3w4MjU2NDV8MHwxfHNlYXJjaHwyfHxHYXJsaWMlMjBidWxicyUyMGdyb3dpbmclMjBpbiUyMHJpY2glMjBzb2lsJTIwaW4lMjBhJTIwZ2FyZGVuLnxlbnwwfHx8fDE3NjI1MTQ5NzZ8MA&ixlib=rb-4.1.0&q=85)\n\nWhile not every Boomer grew their own garlic, many did, especially those with a passion for cooking. They understood the difference between a fresh, pungent clove and the often-milder supermarket varieties. Hardneck garlic, with its robust flavor and easy-to-peel cloves, was a common choice. Today, specialty garlic, particularly unique hardneck varieties, is a prized item at farmer's markets, celebrated for its intense flavor and culinary versatility, a far cry from the generic white bulbs we often find elsewhere.\n\n### 7. Gourmet Radishes\n![a bunch of radishes with green leaves on a white background](https://images.unsplash.com/photo-1701960978767-ae393bb80f04?crop=entropy&cs=srgb&fm=jpg&ixid=M3w4MjU2NDV8MHwxfHNlYXJjaHwxNnx8UmFkaXNoZXN8ZW58MHx8fHwxNzYyNTE2NTgyfDA&ixlib=rb-4.1.0&q=85)\n\nRadishes were a quick and easy crop for many backyard gardeners, offering a peppery crunch and a splash of color. While the classic red globe was common, many also experimented with different varieties. Today, farmer's markets showcase an array of \"gourmet\" radishes\u00e2\u20ac\u201dFrench Breakfast, Watermelon, Easter Egg\u00e2\u20ac\u201dcelebrated for their nuanced flavors and beautiful appearance. What was once a simple, humble root vegetable has become a sophisticated addition to salads and appetizers, a testament to the enduring appeal of fresh, homegrown produce.\n\nThe shift is clear: what was once a necessity, a quiet act of self-sufficiency, has become a conscious choice, a pursuit of quality and connection to the source of our food. There's a beauty in this rediscovery, a recognition that the simple, honest flavors of the earth are worth seeking out, worth savoring. It reminds us that true value often lies not in what's new or trendy, but in the enduring wisdom of the past, and the quiet resilience of a seed pushing through the soil.\n\n\n\n\n\n\n\n\n\n\n\n\n\n\n\n\n"
    },
    {
        "Title": "8 Ways Keeping Things Private Is a Quiet Strenth, According to a Mindfulness Expert",
        "Summary": "In a world that demands constant sharing, discover the quiet wisdom of cultivating an inner sanctuary, where true resilience and authenticity take root away from external noise.",
        "Tags": [
            "'Mindfulness'",
            "'Privacy'",
            "'Self Care'",
            "'Personal Growth'",
            "'Resilience'"
        ],
        "url": "https://raw.githubusercontent.com/ljlabs/vynder-blog/refs/heads/main/livePosts/8 Things You Should Probably Keep To Yourself_ According to a Mindfulness Expert.md",
        "image": "https://images.unsplash.com/photo-1605380911241-60fef15fa8e3?crop=entropy&cs=srgb&fm=jpg&ixid=M3w4MjU2NDV8MHwxfHNlYXJjaHwxfHxwZXJzb24lMjBxdWlldGx5JTIwY29udGVtcGxhdGluZyUyMGZ1dHVyZSUyMGdvYWxzfGVufDB8fHx8MTc2MjUxOTU3Mnww&ixlib=rb-4.1.0&q=85",
        "published": "2025-11-08T07:17:17.517264+00:00",
        "edited": "2025-11-08T07:17:17.517264+00:00",
        "content": "---\nTitle: 8 Ways Keeping Things Private Is a Quiet Strenth, According to a Mindfulness Expert\nSummary: In a world that demands constant sharing, discover the quiet wisdom of cultivating an inner sanctuary, where true resilience and authenticity take root away from external noise.\nTags: ['Mindfulness', 'Privacy', 'Self Care', 'Personal Growth', 'Resilience']\nImage: https://images.unsplash.com/photo-1605380911241-60fef15fa8e3?crop=entropy&cs=srgb&fm=jpg&ixid=M3w4MjU2NDV8MHwxfHNlYXJjaHwxfHxwZXJzb24lMjBxdWlldGx5JTIwY29udGVtcGxhdGluZyUyMGZ1dHVyZSUyMGdvYWxzfGVufDB8fHx8MTc2MjUxOTU3Mnww&ixlib=rb-4.1.0&q=85\nPublishedAt: 2025-11-08T07:17:17.517264+00:00\nEditedAt: 2025-11-08T07:17:17.517264+00:00\n---\nIn a world that constantly urges us to share, to broadcast, to lay bare the intricate details of our lives. From the mundane to the monumental, the unspoken expectation is often to open every window, to invite every gaze. Yet, there's a quiet wisdom in restraint, a profound strength in cultivating an inner world untouched by external noise. It's not about secrecy, but about finding sanctuary. It's about understanding that some seeds grow best in the quiet dark, away from the harsh light of judgment or the fleeting warmth of applause. For those navigating life with quiet determination, without the constant luxury of external validation, this inner privacy becomes a wellspring of resilience-a place where our truest selves can take root and flourish.\n\nTrue peace, as many have found, often comes from within-from a deliberate choice to protect our most vulnerable and potent energies. It's about recognizing that not everything needs an audience, and that some of our deepest experiences are best processed in the quiet chambers of our own hearts. This isn't about hiding; it's about honoring the sacred space of our personal journey.\n\nHere are eight things we learn to keep private, not out of fear, but out of a deep respect for our own unfolding:\n\n### 1. Your Long-Term Goals and Dreams\n\n![Person wearing a hat gazing at the ocean.](https://images.unsplash.com/photo-1743548164519-19c96a2a96a8?crop=entropy&cs=srgb&fm=jpg&ixid=M3w4MjU2NDV8MHwxfHNlYXJjaHwzfHxwZXJzb24lMjBxdWlldGx5JTIwY29udGVtcGxhdGluZyUyMGZ1dHVyZSUyMGdvYWxzfGVufDB8fHx8MTc2MjUxOTU3Mnww&ixlib=rb-4.1.0&q=85)\n\nWe all hold quiet aspirations, visions of where we hope to be, the mountains we dream of climbing. There's a temptation to share them, to seek encouragement or validation. But sometimes, speaking them aloud before they've had a chance to solidify can dissipate their energy. When we hold our dreams close, nurturing them in the silence of our own minds, they gain strength. They become a private compass, guiding our steps without the pressure of external expectations or the discouragement of premature doubt. We learn that the most powerful commitments are often the ones we make to ourselves, in the quiet hours.\n\n### 2. Your Acts of Kindness\n\n![Young plants sprout from the soil in a container.](https://images.unsplash.com/photo-1743012249840-12390e07ba2c?crop=entropy&cs=srgb&fm=jpg&ixid=M3w4MjU2NDV8MHwxfHNlYXJjaHwxNHx8UmFkaXNoZXN8ZW5MHx8fHwxNzYyNTE2NTgyfDA&ixlib=rb-4.1.0&q=85)\n\nThe truest acts of generosity are often those performed without expectation of recognition. When we extend a hand, offer a kind word, or provide support in a moment of need, and then keep it to ourselves, the purity of the act remains intact. It's not about accumulating social currency or building a reputation. It's about the quiet satisfaction of easing another's burden, of contributing to the unseen fabric of human connection. These private acts nourish our own spirit, reminding us of our capacity for compassion, free from the ego's desire for acknowledgment.\n\n### 3. The Depth of Your Spiritual Beliefs or Practices\n\n![Man meditating in lotus pose on yoga mat.](https://images.unsplash.com/photo-1758599879513-9124e9718f2f?crop=entropy&cs=srgb&fm=jpg&ixid=M3w4MjU2NDV8MHwxfHNlYXJjaHwxM3x8QSUyMHBlcnNvbiUyMHNpdHRpbmclMjBpbiUyMGElMjBtZWRpdGF0aXZlJTIwcG9zZSUyMG9uJTIwYSUyMHlvZ2ElMjBtYXQufGVufDB8fHx8MTc2MjUxOTc4NHww&ixlib=rb-4.1.0&q=85)\n\nOur spiritual journey is perhaps the most intimate path we walk. It's a deeply personal exploration of meaning, connection, and purpose. Sharing these profound experiences can sometimes dilute their power, inviting commentary or judgment that can disrupt our inner equilibrium. Whether it's a quiet prayer, a meditative practice, or a deeply held belief, these are sacred spaces where we connect with something larger than ourselves. Protecting them allows us to cultivate a genuine, unadulterated relationship with our own spirit, free from the need to explain or defend.\n\n### 4. Your Personal Struggles and Insecurities\n\n![A person sits on a bench by the water.](https://images.unsplash.com/photo-1749702628686-eab8abb4f283?crop=entropy&cs=srgb&fm=jpg&ixid=M3w4MjU2NDV8MHwxfHNlYXJjaHw3fHxwZXJzb24lMjBxdWlldGx5JTIwY29udGVtcGxhdGluZyUyMGZ1dHVyZSUyMGdvYWxzfGVufDB8fHx8MTc2MjUxOTU3Mnww&ixlib=rb-4.1.0&q=85)\n\nWe all carry burdens, quiet anxieties, and moments of self-doubt. While seeking support from trusted confidantes is vital, indiscriminately sharing every insecurity can leave us feeling exposed and vulnerable in unhelpful ways. There's a difference between seeking help and broadcasting our rawest fears to the world. Learning to process these struggles internally, perhaps through journaling or quiet reflection, allows us to build resilience and self-compassion. It teaches us to be our own gentle witness, to acknowledge our imperfections without letting them define us in the eyes of others.\n\n### 5. Your Financial Situation\n\n![a woman sitting on a bed looking at a laptop](https://images.unsplash.com/photo-1639341076211-929c6700c7eb?crop=entropy&cs=srgb&fm=jpg&ixid=M3w4MjU2NDV8MHwxfHNlYXJjaHwxN3x8QSUyMHBlcnNvbiUyMGxvb2tpbmclMjBhdCUyMGElMjBidWxnZXQlMjBzcHJlYWRzaGVldCUyMG9uJTIwYSUyMGxhcHRvcC58ZW5MHx8fHwxNzYyNTE5Nzk1fDA&ixlib=rb-4.1.0&q=85)\n\nMoney, or the lack of it, is often a source of quiet stress and comparison. Whether we are struggling or thriving, discussing our financial details with others can lead to unnecessary judgment, envy, or unsolicited advice. Our financial journey is deeply personal, intertwined with our choices, responsibilities, and aspirations. Keeping these details private allows us to manage our resources with clarity and intention, free from the external pressures that can arise from others' perceptions of our wealth or lack thereof. It's about maintaining a sense of dignity and control over our own economic reality.\n\n### 6. Family Disputes or Disagreements\n\n![Two people sit on a bench together.](https://images.unsplash.com/photo-1746008460097-458883107266?crop=entropy&cs=srgb&fm=jpg&ixid=M3w4MjU2NDV8MHwxfHNlYXJjaHwzfHxUd28lMjBwZW9wbGUlMjBzaXR0aW5nJTIwd2l0aCUyMHRoZWlyJTIwYmFja3MlMjB0byUyMGVhY2glMjBvdGhlciUyQyUyMGxvb2tpbmclMjB1cHNldC58ZW5MHx8fHwxNzYyNTE5ODA0fDA&ixlib=rb-4.1.0&q=85)\n\nEvery family has its complexities, its unspoken tensions, its moments of friction. These are often deeply rooted and best resolved within the family unit, or with the help of professional guidance. Airing family grievances publicly, even to well-meaning friends, can escalate conflict, create lasting resentment, and damage relationships beyond repair. There's a quiet loyalty in protecting the privacy of our loved ones, even when things are difficult. It's about understanding that some wounds heal best away from the public eye, allowing space for forgiveness and reconciliation.\n\n### 7. Past Mistakes or Regrets\n\n![grayscale photo of persons hand](https://images.unsplash.com/photo-1588611259217-599d2345fc27?crop=entropy&cs=srgb&fm=jpg&ixid=M3w4MjU2NDV8MHwxfHNlYXJjaHw4fHxBJTIwcGVyc29uJTIwbG9va2luZyUyMGRvd24lMjBhdCUyMHRoZWlyJTIwaGFuZHMlMkMlMjBhcHBlYXJpbmclMjByZWdyZXRmdWwufGVufDB8fHx8MTc2MjUxOTgxM3ww&ixlib=rb-4.1.0&q=85)\n\nWe all carry the weight of past errors, choices we wish we could undo. While learning from them is essential, constantly rehashing them or seeking absolution from others can keep us tethered to the past. Mindfulness teaches us to acknowledge these experiences, to learn their lessons, and then to gently release them. Our past mistakes do not define our present worth. Keeping them private allows us to integrate them into our personal narrative without letting them overshadow our capacity for growth and change. It's about finding peace with our imperfect journey.\n\n### 8. Future Plans or Big Decisions\n\n![a woman sitting at a table with a laptop](https://images.unsplash.com/photo-1701760211427-e7a9068028b2?crop=entropy&cs=srgb&fm=jpg&ixid=M3w4MjU2NDV8MHwxfHNlYXJjaHw0fHxBJTIwcGVyc29uJTIwbG9va2luZyUyMGF0JTIwYSUyMGJ1ZGdldCUyMHNwcmVhZHNoZWV0JTIwb24lMjBhJTIwbGFwdG9wLnxlbnMHx8fHwxNzYyNTE5Nzk1fDA&ixlib=rb-4.1.0&q=85)\n\nWhen we are on the cusp of a significant life change-a career move, a relocation, or a personal commitment-there's a natural urge to seek counsel. However, too many voices can cloud our own intuition. Big decisions often require a period of quiet contemplation, a deep listening to our inner wisdom. Sharing our plans prematurely can invite external opinions that, while well-intentioned, might not align with our truest path. We learn to trust our own discernment, to make choices from a place of inner clarity rather than external influence.\n\nIn a world that often feels loud and demanding, the practice of keeping certain things private is not an act of isolation, but a profound act of self-preservation. It's a way to honor our inner landscape, to protect the delicate process of growth, and to cultivate a deep, unwavering sense of self. It reminds us that true strength often resides not in what we reveal, but in what we quietly hold sacred. This quiet resilience, this gentle guardianship of our inner world, is a profound act of self-love, allowing us to navigate the complexities of life with a grounded and authentic spirit.\n\n\n\n\n\n\n\n\n\n\n\n\n\n\n\n\n\n"
    },
    {
        "Title": "9 Everyday Things You Do That Instantly Mark You as Middle Class",
        "Summary": "The quiet habits and unspoken understandings that reveal a life lived with careful calculation, where resilience is built into the daily routine.",
        "Tags": [
            "'Middle Class'",
            "'Everyday Life'",
            "'Resilience'",
            "'Financial Habits'",
            "'Social Observation'"
        ],
        "url": "https://raw.githubusercontent.com/ljlabs/vynder-blog/refs/heads/main/livePosts/9 Everyday Things You Do That Instantly Mark You as Middle Class.md",
        "image": "https://images.unsplash.com/photo-1665809052658-32e8e35fba92?crop=entropy&cs=srgb&fm=jpg&ixid=M3w4MjU2NDV8MHwxfHNlYXJjaHw2fHw5JTIwRXZlcnlkYXklMjBUaGluZ3MlMjBZb3UlMjBEbyUyMFRoYXQlMjBJbnN0YW50bHklMjBNYXJrJTIwWW91JTIwYXMlMjBNaWRkbGUlMjBDbGFzc3xlbnwwfHx8fDE3NjI1MTU5MTZ8MA&ixlib=rb-4.1.0&q=85",
        "published": "2025-11-08T07:17:17.534556+00:00",
        "edited": "2025-11-08T07:17:17.534556+00:00",
        "content": "---\nTitle: 9 Everyday Things You Do That Instantly Mark You as Middle Class\nSummary: The quiet habits and unspoken understandings that reveal a life lived with careful calculation, where resilience is built into the daily routine.\nTags: ['Middle Class', 'Everyday Life', 'Resilience', 'Financial Habits', 'Social Observation']\nImage: https://images.unsplash.com/photo-1665809052658-32e8e35fba92?crop=entropy&cs=srgb&fm=jpg&ixid=M3w4MjU2NDV8MHwxfHNlYXJjaHw2fHw5JTIwRXZlcnlkYXklMjBUaGluZ3MlMjBZb3UlMjBEbyUyMFRoYXQlMjBJbnN0YW50bHklMjBNYXJrJTIwWW91JTIwYXMlMjBNaWRkbGUlMjBDbGFzc3xlbnwwfHx8fDE3NjI1MTU5MTZ8MA&ixlib=rb-4.1.0&q=85\nPublishedAt: 2025-11-08T07:17:17.534556+00:00\nEditedAt: 2025-11-08T07:17:17.534556+00:00\n---\nThere's a language spoken not in words, but in the quiet rhythms of our days, in the small choices we make without thinking. It's a language that tells a story about where we stand in the world, about the invisible lines that shape our lives. For many of us, these subtle cues speak of a middle-class existence, a space defined not by grand gestures or stark deprivation, but by a constant, often unspoken, negotiation with \"enough.\" It's a life where comfort is earned, not assumed, and where resilience is woven into the fabric of everyday habits.\n\nWe learn these habits early, often from watching our parents, and they become so ingrained we barely notice them. Yet, to an observant eye, they are clear markers, small flags signaling a particular kind of journey. They speak of a practical wisdom, a quiet strength born from understanding the value of a dollar and the importance of making things last.\n\nHere are nine everyday things that, without a single word, tell a story of middle-class life:\n\n### 1. The \"Junk Drawer\" in the Kitchen\n\n![A metal box filled with lots of different items](https://images.unsplash.com/photo-1698226929297-0361c435ee7b?crop=entropy&cs=srgb&fm=jpg&ixid=M3w4MjU2NDV8MHwxfHNlYXJjaHwyfHxtZXNzeSUyMGtpdGNoZW4lMjBkcmF3ZXIlMjBmdWxsJTIwb2YlMjByYW5kb20lMjBpdGVtc3xlbnwwfHx8fDE3NjI1MDMxMzJ8MA&ixlib=rb-4.1.0&q=85)\n\nIt's not a sign of slovenliness, but a testament to practicality. Every middle-class kitchen has one: a drawer overflowing with random batteries, twist ties, old keys, a single chopstick, rubber bands, and instruction manuals for appliances long gone. It's the repository for things that *might* be useful someday, items too good to throw away but without a designated home. This drawer speaks to a mindset of making do, of not wasting, and of a quiet hope that a forgotten item might just save a trip to the store or solve a minor household crisis. It's a small, contained chaos that reflects a life lived with an eye towards utility and a slight aversion to unnecessary spending.\n\n### 2. Driving a Car That's Paid Off, or Nearly So\n\n![a silver car parked in front of a white building](https://images.unsplash.com/photo-1693861438989-b222ea2af85b?crop=entropy&cs=srgb&fm=jpg&ixid=M3w4MjU2NDV8MHwxfHNlYXJjaHwxMHx8QSUyMHNpbHZlciUyMHNlZGFuJTIwcGFya2VkJTIwb24lMjBhJTIwcmVzaWRlbnRpYWwlMjBzdHJlZXR8ZW58MHx8fHwxNzYyNTA2ODMyfDA&ixlib=rb-4.1.0&q=85)\n\nYou won't often see the newest model in the driveway. Instead, it's a car that's a few years old, well-maintained, and often meticulously cared for. The goal isn't to impress, but to avoid a car payment. We understand the quiet freedom that comes with owning something outright, or at least having a manageable loan. Every oil change, every tire rotation, every small repair is an investment in extending its life, a conscious decision to prioritize financial stability over fleeting status. This car is a workhorse, a reliable companion, and a symbol of careful planning.\n\n### 3. The Art of Strategic Grocery Shopping\n\n![a store with shelves of products](https://images.unsplash.com/photo-1667669291559-c3c7760ef031?crop=entropy&cs=srgb&fm=jpg&ixid=M3w4MjU2NDV8MHwxfHNlYXJjaHwyMHx8QSUyMHBlcnNvbiUyMGNvbXBhcmluZyUyMHByaWNlcyUyMG9uJTIwYSUyMHNoZWxmJTIwaW4lMjBhJTIwZ3JvY2VyeSUyMHN0b3JlfGVufDB8fHx8MTc2MjUwNzMyM3ww&ixlib=rb-4.1.0&q=85)\n\nGrocery shopping isn't just about filling the fridge; it's a finely tuned operation. We know which day the best sales drop, which store has the cheapest produce, and where to get the best value for meat. Coupons are clipped, mental notes are made, and the weekly menu is often dictated by what's on special. It's a delicate balance between quality and cost, a quiet mastery of the budget that ensures good food on the table without breaking the bank. This isn't about deprivation, but about smart management, a daily act of financial stewardship.\n\n### 4. Tackling Home Repairs Yourself\n\n![a person is holding a water faucet in their hand](https://images.unsplash.com/photo-1643162927500-1e9182e3fae6?crop=entropy&cs=srgb&fm=jpg&ixid=M3w4MjU2NDV8MHwxfHNlYXJjaHwxMnx8QSUyMHBlcnNvbiUyN3MlMjBoYW5kcyUyMGZpeGluZyUyMGElMjBsZWFreSUyMGZhdWNldCUyMHdpdGglMjBhJTIwd3JlbmNofGVufDB8fHx8MTc2MjUwNjcyMXww&ixlib=rb-4.1.0&q=85)\n\nA leaky faucet, a squeaky door, a patch of peeling paint - these aren't immediate calls to a professional. Instead, they're opportunities to pull out the toolbox, watch a YouTube tutorial, and get to work. We learn to be handy, not necessarily because we enjoy it, but because the cost of calling someone else is a significant line item in the budget. There's a quiet satisfaction in fixing something with your own hands, a sense of self-reliance that comes from knowing you can handle the small things. It's a practical skill born of necessity, passed down through generations.\n\n### 5. The \"Good\" Dishes Reserved for Special Occasions\n\n![a table with a white table cloth and place settings](https://images.unsplash.com/photo-1634588376153-1886af9d21c2?crop=entropy&cs=srgb&fm=jpg&ixid=M3w4MjU2NDV8MHwxfHNlYXJjaHwxNXx8QSUyMHRhYmxlJTIwc2V0JTIwd2l0aCUyMGVsZWdhbnQlMkMlMjBzaW1wbGUlMjB3aGl0ZSUyMGRpbm5lcndhcmUlMjBhbmQlMjBnbGFzc3dhcmV8ZW58MHx8fHwxNzYyNTA3MzM2fDA&ixlib=rb-4.1.0&q=85)\n\nThere's a set of plates, maybe a little nicer, a little more delicate, tucked away in the back of the cabinet. These aren't for Tuesday night dinner. These are for Thanksgiving, for a birthday, for when company comes over. Everyday meals are served on sturdy, practical stoneware that can withstand the dishwasher and a few accidental drops. The \"good\" dishes represent a quiet reverence for special moments, a desire to elevate an occasion, and a careful preservation of something valued. It's a small ritual that marks the difference between the ordinary and the extraordinary.\n\n### 6. Consistently Packing a Lunch for Work or School\n\n![A neatly packed lunch box on a wooden desk](https://images.unsplash.com/photo-1546069901-ba9599a7e63c?crop=entropy&cs=srgb&fm=jpg&ixid=M3w4MjU2NDV8MHwxfHNlYXJjaHwxfHxwYWNrZWQlMjBsdW5jaCUyMGJveCUyMG9uJTIwZGVza3xlbnwwfHx8fDE3NjI1MDMxMzJ8MA&ixlib=rb-4.1.0&q=85)\n\nThis isn't a fleeting diet trend; it's a daily discipline. The morning ritual of assembling sandwiches, packing leftovers, and grabbing a piece of fruit is a quiet act of budgeting. We know that buying lunch every day adds up, slowly eroding the weekly grocery budget. The packed lunch is a small, consistent effort to keep those dollars in our pockets, a testament to the understanding that many small savings accumulate into significant ones. It's a practical choice, often made without complaint, because it's simply what we do.\n\n### 7. The Modest, Well-Tended Garden or Yard\n\n![a garden with flowers](https://images.unsplash.com/photo-1658867851985-4b7f06612ba7?crop=entropy&cs=srgb&fm=jpg&ixid=M3w4MjU2NDV8MHwxfHNlYXJjaHw4fHxBJTIwc21hbGwlMkMlMjB3ZWxsLW1haW50YWluZWQlMjBiYWNreWFyZCUyMGdhcmRlbiUyMHdpdGglMjBmbG93ZXJzJTIwYW5kJTIwYSUyMHBhdGlvfGVufDB8fHx8MTc2MjUwNzM0OXww&ixlib=rb-4.1.0&q=85)\n\nIt's not a sprawling landscape, but a small patch of green, carefully mowed, perhaps with a few well-loved flower beds or a small vegetable patch. The effort put into maintaining it speaks volumes. It's a desire for beauty, for order, for a small personal sanctuary within one's means. We prune, we weed, we water, not just for curb appeal, but for the quiet satisfaction of nurturing something, of creating a pleasant space without hiring a professional. It's a reflection of pride in one's home, regardless of its size.\n\n### 8. The Subtle Hum of Anxiety About Unexpected Expenses\n\n![A person looking worriedly at a stack of bills on a table](https://images.unsplash.com/photo-1624811532681-e58a7e25f273?crop=entropy&cs=srgb&fm=jpg&ixid=M3w4MjU2NDV8MHwxfHNlYXJjaHwyfHxwZXJzb24lMjBsb29raW5nJTIwd29ycmllZCUyMGF0JTIwYmlsbHN8ZW58MHx8fHwxNzYyNTAzMTMyfDA&ixlib=rb-4.1.0&q=85)\n\nEven when things are stable, there's a low-level hum of awareness about what could go wrong. A car breakdown, a sudden medical bill, a major appliance failing - these aren't just inconveniences; they're potential crises. We might have a small emergency fund, but we know how quickly it can be depleted. This quiet anxiety isn't about being poor, but about understanding the thin margin, the delicate balance that keeps everything afloat. It shapes our choices, making us cautious, resourceful, and always a little prepared for the unexpected.\n\n### 9. Valuing Practicality Over Luxury in Gifts\n\n![A neatly wrapped gift box with a simple ribbon, suggesting a practical item](https://images.unsplash.com/photo-1513201099705-a9746e1e201f?crop=entropy&cs=srgb&fm=jpg&ixid=M3w4MjU2NDV8MHwxfHNlYXJjaHwxfHxwcmFjdGljYWwlMjBnaWZ0JTIwd3JhcHBlZHxlbnwwfHx8fDE3NjI1MDMxMzJ8MA&ixlib=rb-4.1.0&q=85)\n\nWhen it comes to gifts, the thought often counts most, but practicality holds a special place. A new set of towels, a sturdy tool, a gift card for groceries, or something that genuinely helps with a household need is often more appreciated than a purely frivolous item. This isn't a lack of imagination, but a reflection of a worldview where utility and longevity are highly valued. We give and receive gifts that ease burdens, improve daily life, or simply make things a little more comfortable, understanding that true generosity often lies in meeting a real need.\n\nThese everyday habits aren't just random acts; they are the quiet architecture of a middle-class life. They speak of a constant negotiation with resources, a deep-seated practicality, and a resilience that doesn't boast but simply endures. In these small, often unnoticed actions, we find a shared understanding, a recognition of the quiet strength it takes to build a life with care, one thoughtful choice at a time.\n\n\n\n\n\n\n\n\n\n\n\n\n\n\n\n\n"
    },
    {
        "Title": "9 Milestones Boomers Valued, That Gen Z Is Quietly Rewriting",
        "Summary": "The definition of a \"successful life\" is shifting, with a new generation quietly redefining what truly matters, moving away from traditional markers of achievement.",
        "Tags": [
            "'Gen Z'",
            "'Baby Boomers'",
            "'Milestones'",
            "'Generational Differences'",
            "'Personal Growth'"
        ],
        "url": "https://raw.githubusercontent.com/ljlabs/vynder-blog/refs/heads/main/livePosts/9 Milestones Boomers Valued, That Gen Z Is Quietly Rewriting.md",
        "image": "https://images.unsplash.com/photo-1633500182308-539c1b53dd51?crop=entropy&cs=srgb&fm=jpg&ixid=M3w4MjU2NDV8MHwxfHNlYXJjaHwxNHx8d29tYW4lMjB3aXRoJTIwYmFieSUyMG9uJTIwaGVyJTIwYmFjayUyMGhpa2luZyUyMGFuJTIwYWR2ZW50ZXJvdXMlMjBwYXRoJTIwb24lMjB0b3AlMjBvZiUyMGElMjBtb3VudGFpbiUwQSUwQXxlbnwwfHx8fDE3NjI1MjE3NzZ8MA&ixlib=rb-4.1.0&q=85",
        "published": "2025-11-08T07:17:17.544129+00:00",
        "edited": "2025-11-08T07:17:17.544129+00:00",
        "content": "---\nTitle: 9 Milestones Boomers Valued, That Gen Z Is Quietly Rewriting\nSummary: The definition of a \"successful life\" is shifting, with a new generation quietly redefining what truly matters, moving away from traditional markers of achievement.\nTags: ['Gen Z', 'Baby Boomers', 'Milestones', 'Generational Differences', 'Personal Growth']\nImage: https://images.unsplash.com/photo-1633500182308-539c1b53dd51?crop=entropy&cs=srgb&fm=jpg&ixid=M3w4MjU2NDV8MHwxfHNlYXJjaHwxNHx8d29tYW4lMjB3aXRoJTIwYmFieSUyMG9uJTIwaGVyJTIwYmFjayUyMGhpa2luZyUyMGFuJTIwYWR2ZW50ZXJvdXMlMjBwYXRoJTIwb24lMjB0b3AlMjBvZiUyMGElMjBtb3VudGFpbiUwQSUwQXxlbnwwfHx8fDE3NjI1MjE3NzZ8MA&ixlib=rb-4.1.0&q=85\nPublishedAt: 2025-11-08T07:17:17.544129+00:00\nEditedAt: 2025-11-08T07:17:17.544129+00:00\n---\nEvery generation inherits a blueprint for what a \"successful life\" looks like. For many Boomers, that blueprint was clear, etched with markers of stability, material accumulation, and a predictable progression through life's stages. It was a path that promised security and respect, a quiet affirmation of having \"made it.\" But for those of us coming of age in a different world, with different challenges and different dreams, that blueprint often feels like a relic, a map to a destination we're not even sure we want to reach.\n\nWe're not dismissing the hard work or the values of those who came before us. We're simply observing that the landscape has changed, and with it, our priorities. The quiet resilience we cultivate now isn't about chasing external validation, but about building a life that feels authentic, sustainable, and deeply connected to our own sense of purpose. What once seemed like essential milestones now often feel like distant echoes, irrelevant to the realities we navigate.\n\nThis quiet re-evaluation leads us to redefine what truly constitutes a life well-lived. Here are nine life milestones many Boomers cherished, that Gen Z is quietly rewriting:\n\n### 1. Owning a Large, Single-Family Home\n\n![a garden with a house in the background](https://images.unsplash.com/photo-1671808075748-60e654901956?crop=entropy&cs=srgb&fm=jpg&ixid=M3w4MjU2NDV8MHwxfHNlYXJjaHwxNnx8QSUyMHNtYWxsJTJDJTIwd2VsbC1tYWludGFpbmVkJTIwYmFja3lhcmQlMjBnYXJkZW4lMjB3aXRoJTIwZmxvd2VycyUyMGFuZCUyMGF%20wYXRpb3xlbnwwfHx8fDE3NjI1MDczNDl8MA&ixlib=rb-4.1.0&q=85)\n\nFor Boomers, the detached house with a yard was the ultimate symbol of stability and achievement. It represented roots, family, and a tangible asset. For Gen Z, the economic realities of homeownership are often daunting, and the desire for flexibility, urban living, or smaller, more sustainable spaces often outweighs the dream of a sprawling suburban abode. We're more concerned with living where we can thrive, even if that means renting, co-living, or embracing a more nomadic existence. The quiet burden of a massive mortgage often feels heavier than the perceived prestige of ownership.\n\n### 2. A Lifelong Career with One Company\n\n![A person sitting at a desk in a modern office, looking focused.](https://images.unsplash.com/photo-1522071820081-009f0129c71c?crop=entropy&cs=srgb&fm=jpg&ixid=M3w4MjU2NDV8MHwxfHNlYXJjaHwxfHxwcm9mZXNzaW9uYWwlMjBjYXJlZXIlMjBzdGFiaWxpdHl8ZW5mDB8fHx8MTc2MjUyMDY3N3ww&ixlib=rb-4.1.0&q=85)\n\nThe idea of working for the same company for 30 or 40 years, earning a gold watch and a pension, was a hallmark of Boomer success. It spoke of loyalty, dedication, and a clear path to retirement. Gen Z, however, has grown up in a rapidly changing job market, where job hopping is common, skills are constantly evolving, and the gig economy is a reality. We prioritize meaningful work, work-life balance, and continuous learning over corporate longevity. The quiet pursuit of passion and purpose often trumps the security of a single, unchanging career path.\n\n### 3. Getting Married Young\n\n![A young couple holding hands, walking away from the camera.](https://images.unsplash.com/photo-1519741497674-611481863552?crop=entropy&cs=srgb&fm=jpg&ixid=M3w4MjU2NDV8MHwxfHNlYXJjaHwxfHlvdW5nJTIwY291cGxlJTIwbWFycmlhZ2V8ZW5mDB8fHx8MTc2MjUyMDY5NHww&ixlib=rb-4.1.0&q=85)\n\nFor many Boomers, marriage in their early twenties was a natural progression, a foundational step into adulthood. It was often tied to starting a family and building a life together. Gen Z, on the other hand, often delays marriage, prioritizing personal development, career establishment, and financial stability before committing to a lifelong partnership. We value strong, healthy relationships, but we're less bound by traditional timelines. The quiet confidence in our own timing allows us to build relationships on solid ground, rather than societal expectation.\n\n### 4. Having Children Early\n\n![A young couple holding a baby.](https://images.unsplash.com/photo-1590004987778-bece5c9adab6?crop=entropy&cs=srgb&fm=jpg&ixid=M3w4MjU2NDV8MHwxfHNlYXJjaHwxfHlvdW5nJTIwcGFyZW50cyUyMGJhYnkgZmFtaWx5fGVufDB8fHx8MTc2MjUyMDcxMHww&ixlib=rb-4.1.0&q=85)\n\nSimilar to marriage, having children at a young age was often seen as a natural and expected part of early adulthood for Boomers. It was about starting a family and raising children while still relatively young. Gen Z often faces different economic realities, environmental concerns, and a greater emphasis on intentional parenting. We tend to delay parenthood, if we choose it at all, wanting to ensure we are emotionally, financially, and environmentally prepared. The quiet consideration of what it truly means to bring a child into the world guides our choices, rather than a predetermined age.\n\n### 5. Owning a Luxury Car\n\n![A sleek, expensive car parked in front of a modern building.](https://images.unsplash.com/photo-1503376780353-7e6692767b70?crop=entropy&cs=srgb&fm=jpg&ixid=M3w4MjU2NDV8MHwxfHNlYXJjaHwxfHxsdXh1cnklMjBjYXJzfGVufDB8fHx8MTc2MjUyMDcyN3ww&ixlib=rb-4.1.0&q=85)\n\nA fancy car was often a status symbol for Boomers, a visible sign of hard-earned success and upward mobility. It was about making a statement. For Gen Z, practicality, sustainability, and affordability often take precedence. We're more likely to prioritize reliable transportation, ride-sharing, public transit, or even electric vehicles over a gas-guzzling luxury model. The quiet understanding that experiences and environmental impact often outweigh material displays shapes our choices.\n\n### 6. Accumulating Material Possessions\n\n![A room filled with lots of books and magazines](https://images.unsplash.com/photo-1727902647401-e70c4474079b?crop=entropy&cs=srgb&fm=jpg&ixid=M3w4MjU2NDV8MHwxfHNlYXJjaHwxM3x8bWVzc3klMjBraXRjaGVuJTIwZHJhd2VyJTIwZnVsbCUyMG9mJTIwcmFuZG9tJTIwaXRlbXN8ZW58MHx8fDE3NjI1MDMxMzJ8MA&ixlib=rb-4.1.0&q=85)\n\nFrom fine china to extensive furniture sets, Boomers often valued accumulating possessions as a sign of a well-established home and a comfortable life. These items were often passed down or carefully chosen to last a lifetime. Gen Z, embracing minimalism and a more transient lifestyle, often prefers experiences over things. We value decluttering, sustainability, and the freedom that comes with fewer attachments. The quiet liberation of owning less allows us to move freely and focus on what truly enriches our lives.\n\n### 7. Retirement at a Fixed Age\n\n![An older couple walking on a beach at sunset.](https://images.unsplash.com/photo-1506126613408-eca07ce68773?crop=entropy&cs=srgb&fm=jpg&ixid=M3w4MjU2NDV8MHwxfHNlYXJjaHwxfHxyZXRpcmVtZW50JTIwYWdlZCUyMG9sZGVyJTIwY291cGxlfGVufDB8fHx8MTc2MjUyMDc2MHww&lib=rb-4.1.0&q=85)\n\nThe concept of working until 65 and then enjoying a fixed retirement was a clear goal for many Boomers. It was the reward for a lifetime of labor. For Gen Z, the future of work and retirement is far less certain. We anticipate working longer, perhaps in different capacities, and prioritize financial independence and flexibility over a rigid retirement age. The quiet pursuit of financial literacy and diverse income streams allows us to build a future that is adaptable, rather than bound by traditional expectations.\n\n### 8. A Traditional College Degree as the Only Path to Success\n\n![a person in a graduation gown holding a tassel](https://images.unsplash.com/photo-1672839416679-6e5b2dbd22b5?crop=entropy&cs=srgb&fm=jpg&ixid=M3w4MjU2NDV8MHwxfHNlYXJjaHwzfHxBJTIwcGVyc29uJTIwaW4lMjBhJTIwZ3JhZHVhdGlvbiUyMGNhcCUyMGFuZCUyMGdvd24lMkMlMjBob2xkaW5nJTIwYSUyMGRpcGxvbWEufGVufDB8fHx8MTc2MjUyMTI0OXww&ixlib=rb-4.1.0&q=85)\n\nFor Boomers, a four-year college degree was often seen as the golden ticket to a good job and a successful life. It was the standard entry point. Gen Z, facing rising tuition costs and a rapidly changing job market, is increasingly exploring alternative paths: trade schools, coding bootcamps, online certifications, and entrepreneurship. We value skills and practical experience as much as, if not more than, traditional credentials. The quiet courage to forge our own educational and career paths, even if unconventional, is a hallmark of our generation.\n\n### 9. Living in the Suburbs\n\n![A street lined with potted plants and parked cars](https://images.unsplash.com/photo-1738574345682-86c9cb8e8a33?crop=entropy&cs=srgb&fm=jpg&ixid=M3w4MjU2NDV8MHwxfHNlYXJjaHwxN3x8ZnJlc2glMjBiYXNpbCUyMG1pbnQlMjByb3NlbWFyeSUyMGdhcmRlbnxlbnwwfHx8fDE3NjI1MTQ4MjF8MA&ixlib=rb-4.1.0&q=85)\n\nThe suburbs represented safety, good schools, and a family-friendly environment for many Boomers. It was the ideal setting for raising children and building a community. Gen Z, however, often gravitates towards urban centers for their diversity, cultural opportunities, and access to public transportation, or seeks out rural areas for a deeper connection to nature and a slower pace of life. The quiet desire for community, connection, and a lifestyle that aligns with our values often leads us away from the traditional suburban ideal.\n\nThe quiet shift in what we consider \"successful\" isn't a rejection of the past, but an adaptation to a new present and an uncertain future. It's about recognizing that true fulfillment often lies not in ticking off a prescribed list of achievements, but in building a life that is authentic, meaningful, and resilient on our own terms. We are learning to define success not by what we accumulate, but by how we live, how we connect, and how we contribute to a world that desperately needs our unique perspectives.\n\n\n\n\n\n\n\n\n\n\n\n\n\n\n\n\n"
    }
]